{
  "version": 1,
  "updatedAt": "2026-08-25",
  "globalConfig": {
    "maxSkillsPerPlan": 5,
    "minConfidence": 0.7,
    "autoActivateRiskLevel": "low"
  },
  "categories": [
    {
      "id": "cat-dev",
      "name": "开发"
    },
    {
      "id": "cat-dev-misc",
      "name": "22",
      "parentId": "cat-dev"
    },
    {
      "id": "cat-fe",
      "name": "前端",
      "parentId": "cat-dev"
    },
    {
      "id": "cat-fe-general",
      "name": "前端·通用",
      "parentId": "cat-fe"
    },
    {
      "id": "cat-fe-style",
      "name": "前端·样式与动效",
      "parentId": "cat-fe"
    },
    {
      "id": "cat-fe-viz",
      "name": "前端·数据可视化",
      "parentId": "cat-fe"
    },
    {
      "id": "cat-fe-a11y",
      "name": "前端·组件与无障碍",
      "parentId": "cat-fe"
    },
    {
      "id": "cat-fe-design",
      "name": "前端·设计还原",
      "parentId": "cat-fe"
    },
    {
      "id": "cat-fe-clone",
      "name": "前端·网站复刻",
      "parentId": "cat-fe"
    },
    {
      "id": "cat-doc",
      "name": "文档处理"
    },
    {
      "id": "cat-img",
      "name": "图像处理"
    },
    {
      "id": "cat-video",
      "name": "视频"
    }
  ],
  "skills": [
    {
      "id": "skill-creator",
      "categoryId": "cat-dev-misc",
      "name": "skill-creator",
      "userDescription": "新建/改进/评估 skill",
      "systemDescription": "创建、改进、评估 skill：从零新建、优化已有 skill、跑 eval 测试、基准性能分析、优化 description 触发准确性。",
      "path": "../skills/skill-creator",
      "triggers": [
        "新建 skill",
        "创建技能",
        "create a skill",
        "优化 skill",
        "skill 评估"
      ],
      "semanticTags": [
        "skill",
        "技能",
        "元能力",
        "评估"
      ],
      "requires": [],
      "before": [],
      "after": [],
      "version": "1.0.0",
      "riskLevel": "medium",
      "isIdempotent": false,
      "timeout": 1200,
      "retryable": true,
      "inputSchema": {},
      "outputSchema": {},
      "status": "active",
      "replacedBy": null,
      "applicableConditions": [
        "用户想新建/改进/评估 skill"
      ],
      "unsuitableConditions": [
        "与 skill 创建/优化无关的普通开发任务"
      ]
    },
    {
      "id": "frontend-design",
      "categoryId": "cat-fe-general",
      "name": "frontend-design",
      "userDescription": "Guidance for distinctive, intentional visual design when building new UI or reshaping an existing one. Helps with aesthetic direction, typography, and making choices that don't read as templated defaults.",
      "systemDescription": "Guidance for distinctive, intentional visual design when building new UI or reshaping an existing one. Helps with aesthetic direction, typography, and making choices that don't read as templated defaults.",
      "path": "E:\\code\\frontend-local\\.agents\\skills\\frontend-design",
      "triggers": [
        "前端设计",
        "UI 视觉",
        "landing page",
        "frontend design",
        "避免 AI 模板感"
      ],
      "semanticTags": [],
      "requires": [],
      "before": [],
      "after": [],
      "version": "1.0.0",
      "riskLevel": "low",
      "isIdempotent": true,
      "timeout": 600,
      "retryable": true,
      "inputSchema": {},
      "outputSchema": {},
      "status": "active",
      "replacedBy": null,
      "applicableConditions": [
        "需要有辨识度的前端界面或视觉方向"
      ],
      "unsuitableConditions": [
        "纯后端/API、无 UI"
      ]
    },
    {
      "id": "tailwind-design-system",
      "categoryId": "cat-fe-style",
      "name": "tailwind-design-system",
      "userDescription": "Build scalable design systems with Tailwind CSS v4, design tokens, component libraries, and responsive patterns. Use when creating component libraries, implementing design systems, or standardizing UI patterns.",
      "systemDescription": "Build scalable design systems with Tailwind CSS v4, design tokens, component libraries, and responsive patterns. Use when creating component libraries, implementing design systems, or standardizing UI patterns.",
      "path": "E:\\code\\frontend-local\\.agents\\skills\\tailwind-design-system",
      "triggers": [
        "tailwind",
        "设计系统",
        "design tokens",
        "组件库样式",
        "tailwind v4"
      ],
      "semanticTags": [],
      "requires": [],
      "before": [],
      "after": [],
      "version": "1.0.0",
      "riskLevel": "low",
      "isIdempotent": true,
      "timeout": 600,
      "retryable": true,
      "inputSchema": {},
      "outputSchema": {},
      "status": "active",
      "replacedBy": null,
      "applicableConditions": [
        "用 Tailwind 建设计系统或标准化样式"
      ],
      "unsuitableConditions": [
        "不使用 Tailwind 的项目"
      ]
    },
    {
      "id": "improve-animations",
      "categoryId": "cat-fe-style",
      "name": "improve-animations",
      "userDescription": "",
      "systemDescription": "",
      "path": "E:\\code\\frontend-local\\.agents\\skills\\improve-animations",
      "triggers": [
        "改进动画",
        "动画优化",
        "UI 动效",
        "improve animations",
        "motion polish"
      ],
      "semanticTags": [],
      "requires": [],
      "before": [],
      "after": [],
      "version": "1.0.0",
      "riskLevel": "low",
      "isIdempotent": true,
      "timeout": 600,
      "retryable": true,
      "inputSchema": {},
      "outputSchema": {},
      "status": "active",
      "replacedBy": null,
      "applicableConditions": [
        "需要改进或打磨已有前端动画"
      ],
      "unsuitableConditions": [
        "无 UI / 不做动效"
      ]
    },
    {
      "id": "tailwindcss-animations",
      "categoryId": "cat-fe-style",
      "name": "tailwindcss-animations",
      "userDescription": "",
      "systemDescription": "",
      "path": "E:\\code\\frontend-local\\.agents\\skills\\tailwindcss-animations",
      "triggers": [
        "tailwind 动画",
        "animate-",
        "keyframes",
        "tailwindcss animations"
      ],
      "semanticTags": [],
      "requires": [],
      "before": [],
      "after": [],
      "version": "1.0.0",
      "riskLevel": "low",
      "isIdempotent": true,
      "timeout": 600,
      "retryable": true,
      "inputSchema": {},
      "outputSchema": {},
      "status": "active",
      "replacedBy": null,
      "applicableConditions": [
        "用 Tailwind 工具类做 CSS 动画"
      ],
      "unsuitableConditions": [
        "不使用 Tailwind"
      ]
    },
    {
      "id": "echarts",
      "categoryId": "cat-fe-viz",
      "name": "echarts",
      "userDescription": "You MUST use this when building, styling, debugging, or optimizing Apache ECharts charts in JavaScript, React, or Vue - setup, lifecycle, responsive resizing, theming, large datasets, streaming, SSR, and symptoms like a blank chart or broken resize. Not for choosing chart types or for other charting libraries.",
      "systemDescription": "You MUST use this when building, styling, debugging, or optimizing Apache ECharts charts in JavaScript, React, or Vue - setup, lifecycle, responsive resizing, theming, large datasets, streaming, SSR, and symptoms like a blank chart or broken resize. Not for choosing chart types or for other charting libraries.",
      "path": "E:\\code\\frontend-local\\.agents\\skills\\echarts",
      "triggers": [
        "echarts",
        "图表",
        "大屏",
        "可视化",
        "dashboard chart"
      ],
      "semanticTags": [],
      "requires": [],
      "before": [],
      "after": [],
      "version": "1.0.0",
      "riskLevel": "low",
      "isIdempotent": true,
      "timeout": 600,
      "retryable": true,
      "inputSchema": {},
      "outputSchema": {},
      "status": "active",
      "replacedBy": null,
      "applicableConditions": [
        "需要 ECharts/图表/大屏可视化"
      ],
      "unsuitableConditions": [
        "无图表需求的纯 CRUD 页"
      ]
    },
    {
      "id": "accessibility",
      "categoryId": "cat-fe-a11y",
      "name": "accessibility",
      "userDescription": "Audit and improve web accessibility following WCAG 2.2 guidelines. Use when asked to \"improve accessibility\", \"a11y audit\", \"WCAG compliance\", \"screen reader support\", \"keyboard navigation\", or \"make accessible\".",
      "systemDescription": "Audit and improve web accessibility following WCAG 2.2 guidelines. Use when asked to \"improve accessibility\", \"a11y audit\", \"WCAG compliance\", \"screen reader support\", \"keyboard navigation\", or \"make accessible\".",
      "path": "E:\\code\\frontend-local\\.agents\\skills\\accessibility",
      "triggers": [
        "无障碍",
        "a11y",
        "accessibility",
        "WCAG",
        "可访问性"
      ],
      "semanticTags": [],
      "requires": [],
      "before": [],
      "after": [],
      "version": "1.0.0",
      "riskLevel": "low",
      "isIdempotent": true,
      "timeout": 600,
      "retryable": true,
      "inputSchema": {},
      "outputSchema": {},
      "status": "active",
      "replacedBy": null,
      "applicableConditions": [
        "需要无障碍审查或合规改进"
      ],
      "unsuitableConditions": [
        "无 UI 或明确不做 a11y 的内部工具"
      ]
    },
    {
      "id": "figma-long-page",
      "categoryId": "cat-fe-design",
      "name": "figma-long-page",
      "userDescription": "figma 还原长页面",
      "systemDescription": "将超长 Figma Frame 高保真还原为可预览页面（HTML/CSS），强制走多步流水线：token→拆帧→分段 get_design_context→组装→精修关。用于整页/多节长滚动页，非单个小组件。",
      "path": "../skills/figma-long-page",
      "triggers": [
        "figma 长页",
        "长流程还原",
        "分段还原",
        "还原长页面",
        "figma-long-page",
        "明犀报告式长页"
      ],
      "semanticTags": [
        "figma",
        "设计稿还原",
        "长页面",
        "前端",
        "html/css"
      ],
      "requires": [],
      "before": [],
      "after": [],
      "version": "1.0.0",
      "riskLevel": "low",
      "isIdempotent": true,
      "timeout": 900,
      "retryable": true,
      "inputSchema": {},
      "outputSchema": {},
      "status": "active",
      "replacedBy": null,
      "applicableConditions": [
        "存在 Figma 设计稿或长图链接",
        "目标为整页/长滚动页还原",
        "用户要求高保真还原"
      ],